{
  "$schema": "../../schemas/device.schema.json",
  "schema_version": 1,
  "id": "ram-stick",
  "name": "RAM stick — 10-LED strip",
  "category": "ram",
  "entities": {
    "body": {
      "geometry": "ram_body",
      "size_m": [0.0, 0.0, 0.0],
      "x": 0.0, "y": 0.0, "z": 0.0,
      "rx": 0.0, "ry": 0.0, "rz": 0.0,
      "zone": "strip"
    }
  },
  "zones": [
    {
      "id": "strip",
      "entity": "body",
      "led_count": 10,
      "layout": {
        "type": "strip",
        "spacing_m": 0.012,
        "origin": [-0.054, 0.03, 0.0]
      }
    }
  ]
}
