{
  "$schema": "../../schemas/device.schema.json",
  "schema_version": 1,
  "id": "pc-case",
  "name": "PC case shell",
  "category": "case",
  "entities": {
    "shell": {
      "geometry": "case_shell",
      "size_m": [0.21, 0.47, 0.46],
      "x": 0.0, "y": 0.0, "z": 0.0,
      "rx": 0.0, "ry": 0.0, "rz": 0.0
    }
  },
  "zones": []
}
