{
  "$schema": "../../schemas/device.schema.json",
  "schema_version": 1,
  "id": "monitor",
  "name": "Monitor",
  "category": "furniture",
  "entities": {
    "body": {
      "geometry": "monitor",
      "size_m": [0.62, 0.36, 0.02],
      "x": 0.0, "y": 0.0, "z": 0.0,
      "rx": 0.0, "ry": 0.0, "rz": 0.0
    }
  },
  "zones": []
}
