{
  "$schema": "../../schemas/device.schema.json",
  "schema_version": 1,
  "id": "fan-slw",
  "name": "Lian Li SL Wireless fan — 40 LEDs",
  "category": "fan",
  "entities": {
    "body": {
      "geometry": "fan_body",
      "size_m": [0.0, 0.0, 0.0],
      "x": 0.0, "y": 0.0, "z": 0.0,
      "rx": 0.0, "ry": 0.0, "rz": 0.0,
      "zone": "ring"
    }
  },
  "zones": [
    {
      "id": "ring",
      "entity": "body",
      "led_count": 40,
      "layout": {
        "type": "points",
        "points": [
          [-0.054, 0.016, 0.016],
          [-0.0478, 0.016, 0.0284],
          [-0.0416, 0.016, 0.0408],
          [-0.0347, 0.016, 0.052],
          [-0.0208, 0.016, 0.052],
          [-0.0069, 0.016, 0.052],
          [0.0069, 0.016, 0.052],
          [0.0208, 0.016, 0.052],
          [0.0347, 0.016, 0.052],
          [0.0416, 0.016, 0.0408],
          [0.0478, 0.016, 0.0284],
          [0.054, 0.016, 0.016],
          [0.049, 0.016, 0.058],
          [0.035, 0.016, 0.058],
          [0.021, 0.016, 0.058],
          [0.007, 0.016, 0.058],
          [-0.007, 0.016, 0.058],
          [-0.021, 0.016, 0.058],
          [-0.035, 0.016, 0.058],
          [-0.049, 0.016, 0.058],
          [0.054, 0.016, -0.016],
          [0.0478, 0.016, -0.0284],
          [0.0416, 0.016, -0.0408],
          [0.0347, 0.016, -0.052],
          [0.0208, 0.016, -0.052],
          [0.0069, 0.016, -0.052],
          [-0.0069, 0.016, -0.052],
          [-0.0208, 0.016, -0.052],
          [-0.0347, 0.016, -0.052],
          [-0.0416, 0.016, -0.0408],
          [-0.0478, 0.016, -0.0284],
          [-0.054, 0.016, -0.016],
          [-0.049, 0.016, -0.058],
          [-0.035, 0.016, -0.058],
          [-0.021, 0.016, -0.058],
          [-0.007, 0.016, -0.058],
          [0.007, 0.016, -0.058],
          [0.021, 0.016, -0.058],
          [0.035, 0.016, -0.058],
          [0.049, 0.016, -0.058]
        ]
      }
    }
  ]
}
